{"schema":2,"contract":"codex-baseline-onboarding/v2","platform":"native-windows","mode":"dry-run","repository":"C:\\example\\repo","entries_visited":4,"files":3,"bytes":100,"links_skipped":1,"sensitive_skipped":0,"large_skipped":0,"root_agents":"present","existing_instructions":true,"existing_instructions_require_ack":true,"existing_instructions_acknowledged":false,"git_detected":true,"project_commands_executed":false,"commands":["npm run test"],"manifests":["package.json"],"ai":["AGENTS.md"],"ci":[],"docs":[],"quality":[],"tests":[],"deployment":[],"generated":[],"source_roots":["src"],"sensitive_areas":[],"warnings":[],"parallelism_map":{"statements":[{"kind":"api_boundary","subject":"*","status":"unknown","evidence":["no explicit bounded API boundary declaration"]},{"kind":"generated_ownership","subject":"*","status":"unknown","evidence":["no generated ownership signal"]},{"kind":"package_boundary","subject":".","status":"inferred","evidence":["package.json"]},{"kind":"shared_build_output","subject":"*","status":"unknown","evidence":["no bounded shared build output declaration"]},{"kind":"shared_cache","subject":"*","status":"unknown","evidence":["no bounded shared cache declaration"]},{"kind":"shared_database","subject":"*","status":"unknown","evidence":["no bounded shared database declaration"]},{"kind":"shared_fixture","subject":"*","status":"unknown","evidence":["no bounded shared fixture declaration"]},{"kind":"shared_port","subject":"*","status":"unknown","evidence":["no bounded shared port declaration"]},{"kind":"source_root","subject":"src","status":"inferred","evidence":["src"]},{"kind":"test_shard","subject":"*","status":"unknown","evidence":["no bounded test shard declaration"]},{"kind":"write_conflict","subject":"*","status":"unknown","evidence":["no bounded write-conflict signal"]},{"kind":"write_safe","subject":"*","status":"unknown","evidence":["no bounded write safe declaration"]}]}}
